,Titles,Brands,Prices,Stars,Urls,Ratings,Review_Words
612,audio-technica Headphone Detachable Cable (for Inner Ear) HDC212A/1.2【Japan Domestic Genuine Products】,Visit the Audio-Technica Store,$163.70,No Review,/audio-technica-Headphone-Detachable-HDC212A-1-2%E3%80%90Japan/dp/B076744XZF/ref=sr_1_90?dchild=1&fst=as%3Aoff&keywords=earbuds&qid=1599298632&refinements=p_89%3AAudio-Technica&rnid=2528832011&s=electronics&sr=1-90,No Ratings,['No Review']
613,Philips In-Ear Headphones Extra Bass SHE2650/28,Visit the PHILIPS Store,No Price,3.8 out of 5,/Philips-Headphones-Extra-SHE2650-28/dp/B003DKL53U/ref=sr_1_46?dchild=1&fst=as%3Aoff&keywords=earbuds&qid=1599298549&refinements=p_89%3APHILIPS&rnid=2528832011&s=electronics&sr=1-46,102 ratings,"['extra bass', 'sound quality', 'fell apart', 'ear bud', 'headphones', 'apple earphones', 'foam covers', 'rubber cover', 'highly recommend', 'ear head', 'great sound', 'ears very well', 'much better']"
614,"JLab Audio JBuds Pro Signature Earbuds | Titanium 10mm Drivers | Music Controls, Universal Mic | Custom Fit with Cush Fins | Red",Visit the JLAB Store,$9.88,4.5 out of 5,/Signature-Earbuds-Titanium-Controls-Universal/dp/B07BQJ4ZLW/ref=sr_1_9?dchild=1&fst=as%3Aoff&keywords=earbuds&qid=1599295858&refinements=p_89%3AJLAB&rnid=2528832011&s=electronics&sr=1-9,137 ratings,['No Review']
615,Skullcandy Ink'd 2 Mic (Discontinued by Manufacturer),Visit the Skullcandy Store,$7.99,4.2 out of 5,/Skullcandy-Inkd-Mic-Discontinued-Manufacturer/dp/B004P1ITVC/ref=sr_1_89?dchild=1&fst=as%3Aoff&keywords=earbuds&qid=1599298669&refinements=p_89%3ASkullcandy&rnid=2528832011&s=electronics&sr=1-89,114 ratings,"['skullcandy', 'sound quality', 'another pair', 'volume control', 'stay in my ears', 'outside noise', 'pause music', 'smaller ones', 'sound can be tinny', 'works well', 'noise cancellation', 'mic works']"
616,Audio-Technica ATH-E40 Professional In-Ear Monitor Headphones,Visit the Audio-Technica Store,$99.00,4.1 out of 5,/Audio-Technica-ATH-E40-Professional-Monitor-Headphones/dp/B01AXSYFN6/ref=sr_1_14?dchild=1&fst=as%3Aoff&keywords=earbuds&qid=1599295858&refinements=p_89%3AAudio-Technica&rnid=2528832011&s=electronics&sr=1-14,167 ratings,"['sound quality', 'bang for the buck', 'foam tips', 'great sound', 'audio technica', 'little bit', 'feel like', 'comply tips', 'great value', 'earbuds', 'comply foam', 'soundstage', 'good seal', 'fit issues']"
617,"Sony Wireless Bluetooth In Ear Headphones: Noise Cancelling Sports Workout Ear Buds for Exercise and Running - Cordless, Sweatproof Sport Earphones - White WF-SP700N//W (Renewed)",Visit the Amazon Renewed Store,No Price,2.9 out of 5,/Sony-Wireless-Bluetooth-Ear-Headphones/dp/B07GX8LS5L/ref=sr_1_81?dchild=1&fst=as%3Aoff&keywords=earbuds&qid=1599298226&refinements=p_89%3ASony&rnid=2528832011&s=electronics&sr=1-81,5 ratings,['No Review']
618,JVC HAFX38P Pink Marshmallow Headphones Original/New Brand,Visit the JVC Store,$18.75,4.4 out of 5,/JVC-HAFX38P-Marshmallow-HEADPHONES-Original/dp/B01N7YE82Z/ref=sr_1_104?dchild=1&fst=as%3Aoff&keywords=earbuds&qid=1599298747&refinements=p_89%3AJVC&rnid=2528832011&s=electronics&sr=1-104,14 ratings,['No Review']
619,"JVC HAECX20A Sports Clip Inner Ear Headphones, Blue",Visit the JVC Store,$14.99,3.9 out of 5,/JVC-HAECX20A-Sports-Inner-Headphones/dp/B00VV6X5PY/ref=sr_1_33?dchild=1&fst=as%3Aoff&keywords=earbuds&qid=1599298732&refinements=p_89%3AJVC&rnid=2528832011&s=electronics&sr=1-33,241 ratings,"['sound quality', 'stay in place', 'loss of volume', 'around the back', 'back of the neck', 'right ear', 'sports clip', 'price point', 'another pair', 'sound great', 'earbud', 'stay in my ears', 'volume to the right', 'inner ear']"
620,"Sony XB550AP Extra Bass On-Ear Headset/Headphones with mic for phone call, Black",Visit the Sony Store,$59.99,4.4 out of 5,/Sony-XB550AP-Extra-Headphone-Black/dp/B01MSD6RNP/ref=sr_1_223?dchild=1&fst=as%3Aoff&keywords=earbuds&qid=1599298247&refinements=p_89%3ASony&rnid=2528832011&s=electronics&sr=1-223,712 ratings,"['sound quality', 'extra bass', 'pretty good', 'volume control', 'great sound', 'listening to music', 'build quality', 'much better', 'noise cancelling', 'really good', 'mid range', 'highly recommend', 'smart key', 'price range']"
621,Samsung EO-EG920LW Wired 3.5mm Headset with Microphone (In Jewel Case),Visit the SAMSUNG Store,$10.55,4.1 out of 5,/Samsung-EO-EG920LW-Auriculares-micr%C3%B3fono-0-138/dp/B01LOQ3BW2/ref=sr_1_17?dchild=1&fst=as%3Aoff&keywords=earbuds&qid=1599295858&refinements=p_89%3ASAMSUNG&rnid=2528832011&s=electronics&sr=1-17,"1,401 ratings","['stopped working', 'sound quality', 'earbud', 'like the original', 'waste your money', 'came with my phone', 'listening to music', 'old ones', 'last long', 'volume button', 'ones that came', 'right ear', 'good quality']"
622,PIONEER SE CL522 L Dynamic in-Ear Headphones,Visit the Pioneer Store,$25.15,4 out of 5,/Pioneer-SE-CL522-L-SE-CL522L-Headphones/dp/B00B0F609Y/ref=sr_1_25?dchild=1&fst=as%3Aoff&keywords=earbuds&qid=1599298438&refinements=p_89%3APIONEER&rnid=2528832011&s=electronics&sr=1-25,19 ratings,['No Review']
623,Skullcandy S2IKDY-105 Ink'd 2 Headphone with Inline Mic (Black/Pink),Visit the Skullcandy Store,$14.99,4 out of 5,/Skullcandy-S2IKDY-105-Headphone-Inline-Black/dp/B00CXZDOGM/ref=sr_1_75?dchild=1&fst=as%3Aoff&keywords=earbuds&qid=1599298666&refinements=p_89%3ASkullcandy&rnid=2528832011&s=electronics&sr=1-75,46 ratings,['No Review']
624,"Skullcandy Ink'd 2 Earbuds with Mic1 White/Black/White, One Size",Visit the Skullcandy Store,$19.99,3.7 out of 5,/Skullcandy-Inkd-Earbuds-White-Black/dp/B01MY2LRQU/ref=sr_1_51?dchild=1&fst=as%3Aoff&keywords=earbuds&qid=1599298659&refinements=p_89%3ASkullcandy&rnid=2528832011&s=electronics&sr=1-51,73 ratings,"['sound quality', 'earbuds', 'broke', 'calls', 'earbud', 'leave']"
625,Shure SE215-CL-BT1 Wireless Sound Isolating Earphones with Bluetooth Enabled Communication Cable,Visit the Shure Store,$149.00,3.8 out of 5,/Shure-SE215-CL-BT1-Isolating-Earphones-Communication/dp/B074QJQ3W7/ref=sr_1_14?dchild=1&fst=as%3Aoff&keywords=earbuds&qid=1599295858&refinements=p_89%3AShure&rnid=2528832011&s=electronics&sr=1-14,727 ratings,"['sound quality', 'battery life', 'stopped working', 'bluetooth cable', 'foam tips', 'great sound', 'sound isolation', 'noise cancellation', 'red light', 'noise cancelling', 'noise isolation', 'bluetooth', 'second pair', 'much better']"
626,Sony MDR-EX81LP Bud-Style Stereo Earphones (Black) (Discontinued by Manufacturer),Visit the Sony Store,$40.68,3.5 out of 5,/Sony-MDR-EX81LP-Bud-Style-Discontinued-Manufacturer/dp/B0007N55LO/ref=sr_1_85?dchild=1&fst=as%3Aoff&keywords=earbuds&qid=1599298226&refinements=p_89%3ASony&rnid=2528832011&s=electronics&sr=1-85,393 ratings,"['sound quality', 'ear canal', 'much better', 'wrap around', 'good sound', 'sound great', 'earbud', 'second pair', 'bass response', 'outside noise', 'even though', 'sound good', 'fit my ears', 'ambient noise', 'stay in place']"
627,"BeatsX Wireless Earphones - Apple W1 Headphone Chip, Class 1 Bluetooth, 8 Hours Of Listening Time - Satin Silver",Visit the Beats Store,$84.00,3.7 out of 5,/Beats-MTH62LL-A-BeatsX-Earphones/dp/B07HKHX1PQ/ref=sr_1_3?dchild=1&fst=as%3Aoff&keywords=earbuds&qid=1599295858&refinements=p_89%3ABeats&rnid=2528832011&s=electronics&sr=1-3,"3,663 ratings","['battery life', 'stopped working', 'sound quality', 'waste your money', 'second pair', 'around your neck', 'new pair', 'power button', 'another pair', 'apple store', 'red and white', 'brand new', 'noise cancellation']"
628,Audio Technica Inner Ear Headphone　for iPod / iPhone / iPad Black Crazy ATH-CKL220i BCZ,Visit the Audio-Technica Store,No Price,4 out of 5,/Technica-Headphone-iPhone-ATH-CKL220i-BCZ/dp/B010UKTERO/ref=sr_1_93?dchild=1&fst=as%3Aoff&keywords=earbuds&qid=1599298632&refinements=p_89%3AAudio-Technica&rnid=2528832011&s=electronics&sr=1-93,2 ratings,['No Review']
629,Philips Color Match In-Ear Headphones (Blue) (Discontinued by Manufacturer),Visit the PHILIPS Store,No Price,3.5 out of 5,/Philips-Color-Headphones-Discontinued-Manufacturer/dp/B000RRMIEM/ref=sr_1_65?dchild=1&fst=as%3Aoff&keywords=earbuds&qid=1599298556&refinements=p_89%3APHILIPS&rnid=2528832011&s=electronics&sr=1-65,6 ratings,['No Review']
630,"Panasonic ErgoFit In-Ear Earbud Headphones RP-HJE120K Dynamic Crystal-Clear Sound, Ergonomic Comfort-Fit, 9mm, Black",Visit the Panasonic Store,$8.20,4.2 out of 5,/Panasonic-Headphones-RP-HJE120-K-Ergonomic-Comfort-Fit/dp/B003EM8008/ref=sr_1_33?dchild=1&fst=as%3Aoff&keywords=earbuds&qid=1599298328&refinements=p_89%3APanasonic&rnid=2528832011&s=electronics&sr=1-33,"83,575 ratings","['sound quality', 'stopped working', 'highly recommend', 'another pair', 'much better', 'bang for your buck', 'second pair', 'earbud', 'fit my ears', 'great value', 'skullcandy', 'outside noise', 'work well', 'ever owned']"
631,Philips In-Ear Headphones Music Colors SHE3583/28 (Pink) (Discontinued by Manufacturer),Visit the PHILIPS Store,$19.99,4.4 out of 5,/Philips-Headphones-SHE3583-Discontinued-Manufacturer/dp/B003BT69ZM/ref=sr_1_54?dchild=1&fst=as%3Aoff&keywords=earbuds&qid=1599298556&refinements=p_89%3APHILIPS&rnid=2528832011&s=electronics&sr=1-54,128 ratings,"['sound quality', 'earbuds', 'great sound', 'highly recommend', 'good quality', 'stay in my ears', 'bang for the buck', 'bass response', 'in-ear headphones', 'small ears', 'still work', 'pretty good']"
632,JBL FREEXBLK Free X Wireless in-Ear Headphones - (JBLFREEXBLKBT) Black (Renewed),Visit the Amazon Renewed Store,$45.00,3.9 out of 5,/JBL-FREEXBLK-Free-Wireless-Headphones/dp/B07Q8YS84F/ref=sr_1_14?dchild=1&fst=as%3Aoff&keywords=earbuds&qid=1599295858&refinements=p_89%3AJBL&rnid=2528832011&s=electronics&sr=1-14,550 ratings,"['sound quality', 'battery life', 'earbud', 'buyer beware', 'left earbud', 'comfortable to wear', 'charging case', 'great sound', 'sound good', 'good sound', 'bass', 'buds', 'earbuds', 'renewed', 'ears']"
633,"Skullcandy Jib In-Ear Noise-Isolating Earbuds with Microphone and Remote for Hands-Free Calls, Lightweight, Stereo Sound and Enhanced Base, Wired 3.5mm Jack Connectivity, White/Black",Visit the Skullcandy Store,No Price,3.6 out of 5,/Skullcandy-Noise-Isolating-Microphone-Lightweight-Connectivity/dp/B075F5X8BR/ref=sr_1_61?dchild=1&fst=as%3Aoff&keywords=earbuds&qid=1599298666&refinements=p_89%3ASkullcandy&rnid=2528832011&s=electronics&sr=1-61,486 ratings,['No Review']
634,Sony WI-C600N Wireless Noise-Canceling in-Ear Headphones (Black) with Hardshell Travel Case Bundle,Visit the Sony Store,$149.99,3.5 out of 5,/Sony-WI-C600N-Noise-Canceling-Headphones-Hardshell/dp/B07TRNB7Y2/ref=sr_1_207?dchild=1&fst=as%3Aoff&keywords=earbuds&qid=1599298244&refinements=p_89%3ASony&rnid=2528832011&s=electronics&sr=1-207,11 ratings,['No Review']
635,"Koss KEB15i In-Ear Headphone, Blue",Visit the Koss Store,No Price,3.6 out of 5,/Koss-KEB15i-In-Ear-Headphone-Blue/dp/B00JJIEFI2/ref=sr_1_78?dchild=1&fst=as%3Aoff&keywords=earbuds&qid=1599298266&refinements=p_89%3AKoss&rnid=2528832011&s=electronics&sr=1-78,17 ratings,['No Review']
636,3.28 ft. Gumy Earbuds in Green,Visit the JVC Store,$15.75,No Review,/JVC-Gumy-Earbuds-Green/dp/B00S4Q7OA6/ref=sr_1_79?dchild=1&fst=as%3Aoff&keywords=earbuds&qid=1599298744&refinements=p_89%3AJVC&rnid=2528832011&s=electronics&sr=1-79,No Ratings,['No Review']
637,Samsung WEP210 Bluetooth Wireless Headset (Color Sent Based on Availability. Comes in Silver or Silver/Black) (Discontinued by Manufacturer),Visit the SAMSUNG Store,No Price,2.9 out of 5,/Samsung-WEP210-Availability-Discontinued-Manufacturer/dp/B000ROK6O4/ref=sr_1_70?dchild=1&fst=as%3Aoff&keywords=earbuds&qid=1599298299&refinements=p_89%3ASAMSUNG&rnid=2528832011&s=electronics&sr=1-70,35 ratings,"['ear piece', 'cell phone', 'bluetooth headset', 'battery life', 'waste your money', 'loud enough', 'sound quality', 'volume', 'hear', 'wep', 'button', 'earpiece', 'inexpensive', 'noise', 'forget', 'low']"
638,"Skullcandy Uproar Bluetooth Wireless On-Ear Headphones with Built-In Microphone and Remote, 10-Hour Rechargeable Battery, Soft Synthetic Leather Ear Pillows for Comfort, White/Gray/Red",Visit the Skullcandy Store,$34.99,4.4 out of 5,/Skullcandy-Bluetooth-Headphones-Microphone-Rechargeable/dp/B013UQN7JG/ref=sr_1_94?dchild=1&fst=as%3Aoff&keywords=earbuds&qid=1599298669&refinements=p_89%3ASkullcandy&rnid=2528832011&s=electronics&sr=1-94,"1,750 ratings","['sound quality', 'battery life', 'year old', 'skullcandy', 'great sound', 'bluetooth headphones', 'pretty good', 'highly recommend', 'loud enough', 'lightweight', 'good sound', 'bluetooth connection', 'easy to use']"
639,Diddybeats by Dr.Dre White In-Ear Headphone from Monster (Discontinued by Manufacturer),Visit the Monster Store,$59.99,3.9 out of 5,/Diddybeats-Headphone-Monster-Discontinued-Manufacturer/dp/B003I84KZ2/ref=sr_1_37?dchild=1&fst=as%3Aoff&keywords=earbuds&qid=1599298846&refinements=p_89%3AMonster&rnid=2528832011&s=electronics&sr=1-37,164 ratings,"['sound quality', 'volume control', 'in-ear headphones', 'keep falling', 'tangle free', 'good sound', 'headphones', 'great sound', 'worth the money', 'diddy beats', 'dre beats', 'fall out of your ears', 'return policy', 'left ear']"
640,Powerbeats3 Wireless In-Ear Headphones - Black (Renewed),Visit the Amazon Renewed Store,$64.97,4 out of 5,/Powerbeats3-Wireless-Ear-Headphones-Renewed/dp/B06X979GGB/ref=sr_1_7?dchild=1&fst=as%3Aoff&keywords=earbuds&qid=1599295858&refinements=p_89%3ABeats&rnid=2528832011&s=electronics&sr=1-7,"1,280 ratings","['stopped working', 'battery life', 'sound quality', 'waste your money', 'brand new', 'pair of headphones', 'wireless headphones', 'buyer beware', 'ear tips', 'hold a charge', 'powerbeats 3 wireless', 'next day']"
641,Audio Technica ATH-CKL202ISBK In-Ear Communication Earbuds with Microphone (Black),Visit the Audio-Technica Store,No Price,4.4 out of 5,/Technica-ATH-CKL202ISBK-Communication-Earbuds-Microphone/dp/B00CT8GHMQ/ref=sr_1_21?dchild=1&fst=as%3Aoff&keywords=earbuds&qid=1599295858&refinements=p_89%3AAudio-Technica&rnid=2528832011&s=electronics&sr=1-21,3 ratings,['No Review']
642,JVC HAFX55ZP Inner Ear Headphones (Red) (Discontinued by Manufacturer),Visit the JVC Store,$4.69,3.3 out of 5,/JVC-HAFX55ZP-Headphones-Discontinued-Manufacturer/dp/B000ETG0II/ref=sr_1_176?dchild=1&fst=as%3Aoff&keywords=earbuds&qid=1599298757&refinements=p_89%3AJVC&rnid=2528832011&s=electronics&sr=1-176,3 ratings,['No Review']
643,"Panasonic RPHJE120 in-Ear Headphone, (2 Pack, Black)",Visit the Panasonic Store,$18.49,4.3 out of 5,/Panasonic-RPHJE120-Ear-Headphone-Black/dp/B00HXTHFJA/ref=sr_1_12?dchild=1&fst=as%3Aoff&keywords=earbuds&qid=1599295858&refinements=p_89%3APanasonic&rnid=2528832011&s=electronics&sr=1-12,358 ratings,"['sound quality', 'sound great', 'great sound', 'bang for the buck', 'earphones', 'great value', 'fit well', 'make sure', 'great for the price', 'ever owned', 'different size', 'buds ever', 'every day', 'highly recommend']"
644,JVC HAFX55ZW Inner Ear Headphones (White) (Discontinued by Manufacturer),Visit the JVC Store,No Price,2.5 out of 5,/JVC-HAFX55ZW-Headphones-Discontinued-Manufacturer/dp/B000ETBYHK/ref=sr_1_212?dchild=1&fst=as%3Aoff&keywords=earbuds&qid=1599298761&refinements=p_89%3AJVC&rnid=2528832011&s=electronics&sr=1-212,5 ratings,['No Review']
645,JVC canal type earphone Silver HA-FXH20-S,Visit the JVC Store,$75.53,4.1 out of 5,/JVC-canal-earphone-Silver-HA-FXH20-S/dp/B00OOJDQO0/ref=sr_1_97?dchild=1&fst=as%3Aoff&keywords=earbuds&qid=1599298744&refinements=p_89%3AJVC&rnid=2528832011&s=electronics&sr=1-97,11 ratings,['No Review']
646,The Amazing JVC GUMY SPRT WHT,Visit the JVC Store,No Price,No Review,/Amazing-JVC-GUMY-SPRT-WHT/dp/B00MGASR5W/ref=sr_1_214?dchild=1&fst=as%3Aoff&keywords=earbuds&qid=1599298761&refinements=p_89%3AJVC&rnid=2528832011&s=electronics&sr=1-214,No Ratings,['No Review']
647,Panasonic in-Ear Lightweight Water-Resistant Active Sport Stereo Headphones (Pink),Visit the Panasonic Store,No Price,No Review,/Panasonic-Lightweight-Water-Resistant-Active-Headphones/dp/B00WIZU7SU/ref=sr_1_89?dchild=1&fst=as%3Aoff&keywords=earbuds&qid=1599298338&refinements=p_89%3APanasonic&rnid=2528832011&s=electronics&sr=1-89,No Ratings,['No Review']
648,JVC HA-EXC25-G canal type earphone drip-proof green sports,Visit the JVC Store,$47.53,3.7 out of 5,/JVC-HA-EXC25-G-earphone-drip-proof-sports/dp/B00XBG1FZE/ref=sr_1_115?dchild=1&fst=as%3Aoff&keywords=earbuds&qid=1599298747&refinements=p_89%3AJVC&rnid=2528832011&s=electronics&sr=1-115,14 ratings,['No Review']
649,Bang & Olufsen Earset - Premium Wireless Earphones - 1646005,Visit the Bang & Olufsen Store,$80.99,3.8 out of 5,/Bang-Olufsen-Earset-Wireless-Earphones/dp/B07D8TL5PK/ref=sr_1_7?dchild=1&fst=as%3Aoff&keywords=earbuds&qid=1599295858&refinements=p_89%3ABang+%26+Olufsen&rnid=2528832011&s=electronics&sr=1-7,477 ratings,"['battery life', 'sound quality', 'bang and olufsen', 'ear canal', 'foam pads', 'build quality', 'turn your head', 'small ears', 'inside your ear', 'noise cancelling', 'wireless earbuds', 'high quality', 'noise cancellation']"
650,"Shure SE215 Sound Isolating Earphones with 3.5mm Cable, Remote and Mic, Special Edition White",Visit the Shure Store,$99.00,4.3 out of 5,/Shure-Isolating-Earphones-Remote-Special/dp/B07W6S15P5/ref=sr_1_5?dchild=1&fst=as%3Aoff&keywords=earbuds&qid=1599295858&refinements=p_89%3AShure&rnid=2528832011&s=electronics&sr=1-5,499 ratings,"['sound quality', 'stopped working', 'listening to music', 'left earbud', 'sound great', 'noise cancellation', 'sound isolation', 'foam tips', 'around the ear', 'motorcycle helmet', 'another pair', 'best ever', 'left ear']"
651,SONY Wireless Stereo Headset SBH56B (Black)【Japan Domestic Genuine Products】,Visit the Sony Store,No Price,3.8 out of 5,/Wireless-Headset-Domestic-Genuine-Products%E3%80%91/dp/B072KM5T6L/ref=sr_1_191?dchild=1&fst=as%3Aoff&keywords=earbuds&qid=1599298240&refinements=p_89%3ASony&rnid=2528832011&s=electronics&sr=1-191,52 ratings,['No Review']
652,JBL Reflect Fit in-Ear Wireless Headphones with Heart-Rate Monitor (Black),Visit the JBL Store,No Price,3.3 out of 5,/JBL-Reflect-Wireless-Headphones-Heart-Rate/dp/B076F8QJ1B/ref=sr_1_50?dchild=1&fst=as%3Aoff&keywords=earbuds&qid=1599298816&refinements=p_89%3AJBL&rnid=2528832011&s=electronics&sr=1-50,27 ratings,"['heart rate', 'rate monitor', 'battery life', 'neck', 'app', 'bluetooth', 'earbuds']"
653,Sony MDR-J10 H.Ear Headphones with Non-Slip Design (Blue),Visit the Sony Store,No Price,3.8 out of 5,/Sony-MDR-J10-Headphones-Non-Slip-Design/dp/B00007EDM8/ref=sr_1_101?dchild=1&fst=as%3Aoff&keywords=earbuds&qid=1599298230&refinements=p_89%3ASony&rnid=2528832011&s=electronics&sr=1-101,"2,724 ratings","['sound quality', 'ear canal', 'headphones', 'small ears', 'second pair', 'stopped working', 'another pair', 'hear the music', 'last a long', 'listening to music', 'fit my ears', 'pair of headphones', 'much better']"
654,"Jabra Elite 75t Earbuds – True Wireless Earbuds with Charging Case, Titanium Black – Bluetooth Earbuds with a More Comfortable, Secure Fit, Long Battery Life and Great Sound Quality",Visit the Jabra Store,$149.99,4.1 out of 5,/Jabra-Elite-75t-Earbuds-Comfortable/dp/B07X9VG6ZJ/ref=sr_1_1?dchild=1&fst=as%3Aoff&keywords=earbuds&qid=1599295858&refinements=p_89%3AJabra&rnid=2528832011&s=electronics&sr=1-1,"4,168 ratings","['battery life', 'sound quality', 'left earbud', 'charging case', 'noise cancellation', 'right earbud', 'wireless earbuds', 'earbud', 'left ear', 'true wireless', 'noise cancelling', 'listening to music', 'call quality']"
655,JBL Synchros Reflect BT In-Ear Bluetooth Sport Headhpones Green,Visit the JBL Store,$140.00,2.8 out of 5,/synchros-Reflect-Bluetooth-Sport-headhpones/dp/B00KZJ1GMC/ref=sr_1_125?dchild=1&fst=as%3Aoff&keywords=earbuds&qid=1599298827&refinements=p_89%3AJBL&rnid=2528832011&s=electronics&sr=1-125,28 ratings,"['sound quality', 'ear', 'headphones', 'bluetooth', 'gym']"
656,"JLab Audio Epic Executive Wireless Active Noise Canceling Earbuds | Bluetooth 4.1 | 11-Hour Battery Life | Universal Music Control | Bluetooth Headphones, Travel Case Included | Black",Visit the JLAB Store,$89.99,3.7 out of 5,/Executive-Canceling-Bluetooth-Universal-Headphones/dp/B0788G1JFJ/ref=sr_1_27?dchild=1&fst=as%3Aoff&keywords=earbuds&qid=1599298365&refinements=p_89%3AJLAB&rnid=2528832011&s=electronics&sr=1-27,69 ratings,"['noise cancelling', 'battery life', 'sound quality', 'earbuds', 'active noise', 'bluetooth earbuds', 'passive noise', 'great sound', 'stay connected', 'work well', 'background noise', 'phone is in my pocket', 'cancelling feature']"
657,"Samsung (2 Pack) OEM Wired 3.5mm White Headset with Microphone, Volume Control, and Call Answer End Button [EO-EG920BW] for Samsung Galaxy S6 Edge+ / S6 / S5, Galaxy Note 5/4 / Edge (Bulk Packaging)",Visit the SAMSUNG Store,$11.99,4 out of 5,/Samsung-Headset-Microphone-EO-EG920BW-Packaging/dp/B014DYJ67Q/ref=sr_1_10?dchild=1&fst=as%3Aoff&keywords=earbuds&qid=1599295858&refinements=p_89%3ASAMSUNG&rnid=2528832011&s=electronics&sr=1-10,"4,272 ratings","['sound quality', 'stopped working', 'waste of money', 'earbud', 'second pair', 'came with my phone', 'last long', 'broke within', 'knock offs', 'right ear', 'headphones', 'get what you pay', 'right side', 'poor quality']"
658,"JLab Audio J4 Heavy Bass, Rugged Metal in-Ear Headphone, Guaranteed for Life - Pirple",Visit the JLAB Store,$14.99,3.9 out of 5,/Audio-Heavy-Rugged-Headphone-GUARANTEED/dp/B0018YYVUW/ref=sr_1_21?dchild=1&fst=as%3Aoff&keywords=earbuds&qid=1599295858&refinements=p_89%3AJLAB&rnid=2528832011&s=electronics&sr=1-21,"1,861 ratings","['sound quality', 'stopped working', 'earbud', 'heavy duty', 'headphones', 'ear pieces', 'another pair', 'build quality', 'good sound', 'much better', 'ever owned', 'new pair', 'skullcandy', 'highly recommend']"
659,Jabra SPORT COACH (Blue) Wireless Bluetooth Earbuds for Cross-Training - Retail Packaging,Visit the Jabra Store,No Price,2.4 out of 5,/Jabra-Wireless-Bluetooth-Earbuds-Cross-Training/dp/B0106V8O8M/ref=sr_1_24?dchild=1&fst=as%3Aoff&keywords=earbuds&qid=1599295858&refinements=p_89%3AJabra&rnid=2528832011&s=electronics&sr=1-24,140 ratings,"['sound quality', 'sport coach', 'battery life', 'heart rate', 'rate monitor', 'stopped working', 'coach wireless', 'cross training', 'red light', 'really like', 'sport life', 'stay put', 'waste of money', 'bluetooth headphones']"
660,"Sony MDREX15AP Fashion ColorEX Series in-Ear Headphones with Microphone Bundle (Violet, 5-Pack)",Visit the Sony Store,$34.99,No Review,/Sony-MDREX15AP-Fashion-Headphones-Microphone/dp/B0898ZQVKS/ref=sr_1_75?dchild=1&fst=as%3Aoff&keywords=earbuds&qid=1599298223&refinements=p_89%3ASony&rnid=2528832011&s=electronics&sr=1-75,No Ratings,['No Review']
661,Sony Earphones with Smartphone Mic and Control - Pink,Visit the Sony Store,$14.20,4.3 out of 5,/Sony-Earphones-Smartphone-Mic-Control/dp/B00I3LV2FK/ref=sr_1_181?dchild=1&fst=as%3Aoff&keywords=earbuds&qid=1599298240&refinements=p_89%3ASony&rnid=2528832011&s=electronics&sr=1-181,289 ratings,['No Review']
662,"Sony MDR-EX25LP/BLU Earbuds, Blue",Visit the Sony Store,$39.99,4.6 out of 5,/Sony-MDR-EX25LP-BLU-Earbuds-Blue/dp/B00BP115LG/ref=sr_1_114?dchild=1&fst=as%3Aoff&keywords=earbuds&qid=1599298230&refinements=p_89%3ASony&rnid=2528832011&s=electronics&sr=1-114,9 ratings,['No Review']
663,JVC HAFX5W Gumy(R) Plus Inner-Ear Earbuds (White) Consumer Electronic,Visit the JVC Store,$27.80,No Review,/JVC-Inner-Ear-Earbuds-Consumer-electronic/dp/B0143ITWLM/ref=sr_1_110?dchild=1&fst=as%3Aoff&keywords=earbuds&qid=1599298747&refinements=p_89%3AJVC&rnid=2528832011&s=electronics&sr=1-110,No Ratings,['No Review']
664,Sony Premium Lightweight Extra Bass Noise-Cancelling Earbud Headphones with in-line Microphone and Remote for Android Smartphone (Red) …,Visit the Sony Store,$44.99,4.5 out of 5,/Sony-Lightweight-Extra-Bass-Headphones/dp/B00M8PSZ5C/ref=sr_1_29?dchild=1&fst=as%3Aoff&keywords=earbuds&qid=1599298213&refinements=p_89%3ASony&rnid=2528832011&s=electronics&sr=1-29,22 ratings,['No Review']
665,JVC HAF12A in-Ear Stereo Headphones - Blue,Visit the JVC Store,$18.49,No Review,/JVC-HAF12A-Ear-Stereo-Headphones/dp/B08B32P93G/ref=sr_1_181?dchild=1&fst=as%3Aoff&keywords=earbuds&qid=1599298757&refinements=p_89%3AJVC&rnid=2528832011&s=electronics&sr=1-181,No Ratings,['No Review']
666,Pioneer SE-C3T-GR Mint Green in-Ear Wired Headphone,Brand: PIONEER,$29.96,No Review,/Pioneer-SE-C3T-GR-Green-Wired-Headphone/dp/B07X7Y7C7X/ref=sr_1_29?dchild=1&fst=as%3Aoff&keywords=earbuds&qid=1599298438&refinements=p_89%3APIONEER&rnid=2528832011&s=electronics&sr=1-29,No Ratings,['No Review']
667,JBL JBLFREEXBLKBTAM Free X True Wireless in-Ear Headphones with Mic - Bluetooth - Black (Renewed),Visit the Amazon Renewed Store,$59.99,4.2 out of 5,/JBL-JBLFREEXBLKBTAM-Free-Wireless-Headphones/dp/B084TB8H6X/ref=sr_1_25?dchild=1&fst=as%3Aoff&keywords=earbuds&qid=1599295858&refinements=p_89%3AJBL&rnid=2528832011&s=electronics&sr=1-25,17 ratings,['No Review']
668,Jvc- Ha-f130-an-e - in Ear Gumy Headphones - Blue,Visit the JVC Store,$7.90,3.8 out of 5,/Jvc-Ha-f130-Gumy-Headphones/dp/B00177YJWA/ref=sr_1_38?dchild=1&fst=as%3Aoff&keywords=earbuds&qid=1599298732&refinements=p_89%3AJVC&rnid=2528832011&s=electronics&sr=1-38,6 ratings,['No Review']
669,Pioneer Neck Band Type Bluetooth Earphone SE-C7BT-B (All Black)【Japan Domestic Genuine Products】 【Ships from Japan】,Visit the Pioneer Store,No Price,3.5 out of 5,/Bluetooth-Earphone-SE-C7BT-B-Domestic-products%E3%80%91/dp/B079D8F9DQ/ref=sr_1_15?dchild=1&fst=as%3Aoff&keywords=earbuds&qid=1599295858&refinements=p_89%3APIONEER&rnid=2528832011&s=electronics&sr=1-15,40 ratings,['No Review']
